,SrcEntity,TgtEntity,SrcLabel,TgtLabel,label
4338,C61246,DOID_0060705,disease duncan lymphoproliferative syndrome x linked,xlp1,1
4339,C61269,DOID_14502,cholesterol disease lipidosis niemann pick sphingomyelin syndrome,cholesterol disease ester storage,0
4340,C39832,DOID_4007,bladder carcinoma cell neoplastic process squamous verrucous,bladder carcinoma,0
4341,C84761,DOID_2383,disease hereditary hyperbilirubinemia syndrome,hyperbilirubinemia icterus jaundice neonatal,0
4342,C116973,DOID_3385,bacterial vaginosis,bacterial vaginosis,1
4343,C34540,DOID_0080180,dipetalonema dipetalonemiasis disease infection syndrome,congenital infection syndrome virus zika zikv,0
4344,C27332,DOID_4638,postauricular lymphadenitis,lymphadenitis postauricular,1
4345,C50486,DOID_4419,cerebral disease infarction ischemia syndrome,benign deep fibrous histiocytoma,0
4346,C112200,DOID_4,disease effluvium syndrome telogen,disease,0
4347,C3744,DOID_1618,benign breast fibroadenoma neoplastic process,breast fibroadenoma,1
4348,C3424,DOID_13515,bourneville complex disease sclerosis syndrome tsc tuberous,tuberous sclerosis,1
4349,C4376,DOID_3021,disease failure insufficiency kidney renal syndrome,acute failure kidney,0
4350,C40439,DOID_6179,carcinoma cell hypercalcemic neoplastic ovarian process sccoht small type,carcinoma cell ovarian small,0
4351,C27143,DOID_7263,disease ige immunodeficiency selective syndrome,deficiency disease igd selective,0
4352,C85175,DOID_0050830,artery disease mesenteric superior syndrome,artery disease peripheral,0
4353,C4558,DOID_4353,body ciliary malignant melanoma neoplastic process,body ciliary disease,0
4354,C3213,DOID_4624,angiomatosis anomalad cavernous chondrodysplasia chondroplasia disease dyschondroplasia enchondromatosis hemangioma hemangiomata maffucci syndrome,disease dyschondroplasia enchondromatosis multiple ollier osteochondromatosis,0
4355,C3088,DOID_0001816,neoplastic process,angiosarcoma hemangiosarcoma,1
4356,C123330,DOID_0110020,degeneration disease macular syndrome,age armd8 degeneration macular relate,0
4357,C118783,DOID_0110636,1a congenital disease dystrophy mdc1a merosin deficient muscular syndrome type,congenital muscular dystrophy due to laminin alpha2 deficiency,1
4358,C8263,DOID_0080149,adult acute differentiated monocytic leukemia,acute adult leukemia monocytic,1
4359,C5532,DOID_2885,neoplastic process,benign phyllode prostate tumor,1
4360,C50486,DOID_224,cerebral disease infarction ischemia syndrome,attack cerebral ischemia ischemic transient,0
4361,C40201,DOID_5272,adenocarcinoma cervical neoplastic process serous,intestinal sarcoma small,0
4362,C3868,DOID_9253,gists,gastrointestinal stromal tumor,1
4363,C3564,DOID_5467,malignant conjunctival neoplasm,cancer conjunctiva conjunctival malignant neoplasm,1
4364,C131685,DOID_0060573,disease syndrome type von willebrand,von willebrand disease type i,1
4365,C6507,DOID_5704,sclerosing atypical lipomatous tumor well differentiated liposarcoma,liposarcoma sclerosing,1
4366,C6897,DOID_7571,neoplastic process,cystic malignant nephroma,1
4367,C5041,DOID_710,disorder find impairment impediment manifestation speech,leukemia manifestation splenic,0
4368,C4425,DOID_2597,glottis neoplasm,glottis neoplasm,1
4369,C4425,DOID_2597,neoplasm of glottis,glottis neoplasm,1
4370,C6903,DOID_4844,ependymoma neoplastic process tanycytic,benign ependymoma,0
4371,C9227,DOID_0090081,deficiency disease gonadotropin hypogonadism hypogonadotropism syndrome,anosmia hypogonadism hypogonadotropic without,0
4372,C26956,DOID_8642,hodgkins paragranuloma,hodgkin paragranuloma,1
4373,C27870,DOID_6024,deficiency disease immunoglobulin isotype selective syndrome,deficiency disease ige selective,0
4374,C7811,DOID_5693,adult liposarcoma neoplastic process,adult liposarcoma,1
4375,C123433,DOID_9274,disease hyperlysinemia syndrome,hyperlysinemia,1
4376,C3424,DOID_13515,disease or syndrome,sclerosis tuberous,1
4377,C97132,DOID_8659,chickenpox,chickenpox,1
4378,C3371,DOID_37,disease or syndrome,disease skin subcutaneous tissue,1
4379,C118460,DOID_14798,blount disease syndrome,blounts disease,1
4380,C84777,DOID_0060642,bullosa disease ichthyosis siemens syndrome,autosomal bullosa dystrophic epidermolysis generalisata gravis hallopeau siemens rdeb recessive type,0
4381,C84709,DOID_14452,disease familial paralysis periodic syndrome,hypokalemic paralysis periodic,0
4382,C60989,DOID_0110660,disease gravis myasthenia syndrome,aggregate cms12 congenital myasthenia myasthenic syndrome tubular,0
4383,C5484,DOID_5517,cell gastric granular malignant neoplasm neoplastic process stomach tumor,carcinoma gastric stomach,0
4384,C5130,DOID_4877,adenocystic breast carcinoma,adenoid breast carcinoma cystic,1
4385,C61269,DOID_14504,sphingomyelin cholesterol lipidosis,block cholesterol deficiency disease esterification form juvenile lipidosis niemann pick sphingomyelin sphingomyelinase subacute type,1
4386,C6022,DOID_5288,larynx leiomyosarcoma,larynx leiomyosarcoma,1
4387,C5833,DOID_270,extraskeletal hepatic liver neoplastic osteogenic osteosarcoma process sarcoma,liver sarcoma,0
4388,C5678,DOID_0050913,bowel colorectal intestine large lipoma neoplastic process,adenocarcinoma intestine large,0
4389,C62018,DOID_0110112,2nd atrioventricular av block degree disease ii mobitz mo bitz second syndrome type,asd atrial atrioventricular av conduction defect defect atrioventricular heart septal syndrome without,0
4390,C7157,DOID_5048,posterior pituitary gland tumor,gland neoplasm pituitary posterior,1
4391,C84652,DOID_0050469,costello disease syndrome,costello syndrome,1
4392,C40320,DOID_4239,alveolar neoplastic part process sarcoma soft vulvar,adult alveolar childhood part sarcoma soft,0
4393,C6888,DOID_6530,thymoma type b2 nos,cortical thymoma,1
4394,C3031,DOID_2173,eyelid tumor,eyelid neoplasm,1
4395,C7359,DOID_2870,adenocarcinoma endometrial endometrium malignant neoplastic otherwise process specify,endometrial adenoacanthoma,1
4396,C35194,DOID_5074,disease dystrophy hereditary retinal syndrome,ependymal ependymoma malignant tumor,0
4397,C50486,DOID_326,cerebral disease infarction ischemia syndrome,ischemia,0
4398,C4641,DOID_4863,astrocytoma cord neoplastic process spinal,astrocytoma cord spinal,1
4399,C35709,DOID_7765,aagenaes disease syndrome,coat disease syndrome,0
4400,C4967,DOID_5604,adult all,acute adult leukemia lymphocytic,1
4401,C6507,DOID_5704,neoplastic process,liposarcoma sclerosing,1
4402,C84686,DOID_14250,disease empty sella syndrome,syndrome,0
4403,C137957,DOID_0110645,disease or syndrome,long lqt2 qt syndrome,1
4404,C3009,DOID_28,disease or syndrome,disease endocrine system,1
4405,C27204,DOID_1575,rheumatologic disorder,disease rheumatic,1
4406,C61254,DOID_10587,beta galactosidase cell deficiency disease galactosylceramide globoid krabbe leukodystrophy lipidosis syndrome,cell disease globoid krabbe leukodystrophy leukoencephalopathy,1
4407,C3739,DOID_4415,benign fibrous histiocytoma,fibrous histiocytoma,1
4408,C84686,DOID_4,disease empty sella syndrome,disease,0
4409,C39924,DOID_8193,macrocystic neoplastic pattern process sac testicular tumor yolk,papillary pattern sac testicular tumor yolk,0
4410,C3398,DOID_2664,gland neoplasm neoplastic no process sweat tumor,sweat gland neoplasm,1
4411,C3575,DOID_170,malignant endocrine tumor,cancer endocrine gland malignant neoplasm,1
4412,C5846,DOID_3698,colloid carcinoma of the bile duct,adenocarcinoma bile duct mucinous,1
4413,C84926,DOID_0050765,disease or syndrome,neuroacanthocytosis,1
4414,C92950,DOID_14250,disease gc gonorrhea syndrome,syndrome,0
4415,C98871,DOID_0090129,carnitine deficiency disease palmitoyltransferase syndrome,1a carnitine cpt cpt1a deficiency hepatic ia l cpt1 palmitoyl palmitoyltransferase transferase type,1
4416,C27539,DOID_4282,basal carcinoma cell infiltrate neoplastic no process skin,basal carcinoma cell pigment skin,0
4417,C6631,DOID_12064,mediastinal neurofibroma,mediastinum neurofibroma,1
4418,C3031,DOID_2173,tumor of the eyelid,eyelid neoplasm,1
4419,C61254,DOID_1926,beta galactosidase cell deficiency disease galactosylceramide globoid krabbe leukodystrophy lipidosis syndrome,acid beta glucosidase deficiency disease gaucher glocucerebrosidase glucosylceramide kerasin thesaurismosis,0
4420,C118437,DOID_11721,gsd7,disease glycogen storage type vii,1
4421,C3654,DOID_10964,cholesteatoma disease ear middle syndrome,cholesteatoma ear middle,1
4422,C7157,DOID_14042,gland neoplasm neoplastic neurohypophysis pituitary posterior process tumor,bipolar disorder,0
4423,C4577,DOID_184,cancer cerebral cerebrum hemisphere hemispheric malignant neoplasm neoplastic process tumor,bone cancer malignant neoplasm,0
4424,C7566,DOID_0060548,breast cancer carcinoma neoplastic process sporadic,breast cancer carcinoma luminal tumor,0
4425,C6176,DOID_4939,carcinoma cell neoplastic neuroendocrine process small ureter ureteral,carcinoma ureter,0
4426,C8196,DOID_9072,finding,granuloma lethal midline,1
4427,C35079,DOID_3225,disease disorder syndrome trachea tracheal,tracheal disease,1
4428,C3205,DOID_2689,neoplastic process,lymphangiosarcoma skin,1
4429,C3213,DOID_255,angiomatosis anomalad cavernous chondrodysplasia chondroplasia disease dyschondroplasia enchondromatosis hemangioma hemangiomata maffucci syndrome,hemangioma,0
4430,C6176,DOID_5539,carcinoma cell neoplastic neuroendocrine process small ureter ureteral,carcinoma cell squamous ureter,0
4431,C6637,DOID_5123,mediastinal mediastinum mesenchymal neoplasm neoplastic process soft tissue tumor,leiomyoma mediastinum,0
4432,C4816,DOID_4407,dermatitis disease photodermatitis photosensitive photosensitivity reaction syndrome,phototoxic dermatitis,1
4433,C35419,DOID_1650,axilla axillary lipoma neoplastic process,axillary breast cancer female tail,0
4434,C5824,DOID_8389,tumor of the lumbar plexus,lumbar neoplasm plexus,1
4435,C3092,DOID_0110505,disease hemoglobinopathy iron metabolism syndrome,autosomal deafness dfnb48 nonsyndromic recessive,0
4436,C119054,DOID_0050854,muckle wells syndrome,muckle wells syndrome,1
4437,C7157,DOID_5048,neoplastic process,gland neoplasm pituitary posterior,1
4438,C26956,DOID_0060060,hodgkin neoplastic no paragranuloma process,lymphoma non hodgkin,0
4439,C5846,DOID_3698,mucinous carcinoma of the bile duct,adenocarcinoma bile duct mucinous,1
4440,C3867,DOID_1963,cancer carcinoma fallopian neoplastic process tube,carcinoma fallopian tube,1
4441,C85046,DOID_12108,disease retinoschisis syndrome,bullous retinoschisis,0
4442,C84761,DOID_0050120,disease hereditary hyperbilirubinemia syndrome,haemophagocytic hemophagocytic hp lymphohistiocytosis syndrome,0
4443,C94358,DOID_1876,behavioral dysfunction mental sadism sexual,dysfunction sexual,0
4444,C27357,DOID_712,refractory hematologic malignancy,cancer hematologic refractory,1
4445,C5292,DOID_12016,convexity frontal meningioma neoplastic process,frontal lobe neoplasm,0
4446,C3009,DOID_28,endocrine system disorder,disease endocrine system,1
4447,C5855,DOID_5438,bile duct extrahepatic leiomyoma neoplastic process,adenoma bile duct extrahepatic,0
4448,C9242,DOID_13254,colon colonic malignant neoplasm neoplastic process tumor,colon colonic disease diverticular diverticulitis,0
4449,C6282,DOID_4008,cancer carcinoma cell fallopian neoplastic process squamous tube,carcinoma cell fallopian transitional tube,0
4450,C3112,DOID_12678,laboratory or test result,hypercalcemia,1
4451,C34848,DOID_1876,behavioral dysfunction mental neurosis,dysfunction sexual,0
4452,C6848,DOID_4892,adenocarcinoma of the middle ear,adenocarcinoma ear middle,1
4453,C4642,DOID_3073,grade iv astrocytic tumor of the brain,brain glioblastoma multiforme,1
4454,C39885,DOID_7598,acinar adenocarcinoma lymphoepithelioma like neoplastic process prostate variant,carcinoma cervical lymphoepithelioma like,0
4455,C9242,DOID_5353,colon colonic malignant neoplasm neoplastic process tumor,colonic disease,0
4456,C125592,DOID_0060468,disease holt oram syndrome,holt oram syndrome,1
4457,C50503,DOID_13336,congenital toxoplasmosis,congenital toxoplasmosis,1
4458,C75463,DOID_3919,disease prader prader labhart willi prader willi prader willi labhart syndrome willi,cystic neoplasm pancreatic serous,0
4459,C34996,DOID_13405,cutaneous disease sarcoidosis syndrome,cardiac sarcoidosis,0
4460,C3564,DOID_5467,conjunctiva conjunctival malignant neoplasm neoplastic process tumor,conjunctival cancer,1
4461,C26874,DOID_5679,detach detachment disease retina retinal syndrome,disease retinal,0
4462,C114902,DOID_0060639,diabetes disease mellitus neonatal permanent syndrome,pdmi,1
4463,C7928,DOID_6053,neoplastic process,cancer cell germ pediatric,1
4464,C8196,DOID_9072,cavity find granuloma lesion lethal midfacial midline nasal necrotising paranasal sinus,lethal midline granuloma,1
4465,C3192,DOID_3315,benign lipoma neoplastic no process,multiple lipomatosis,1
4466,C84532,DOID_9153,acrodermatitis disease syndrome,cottonpox milkpox minor variola whitepox,0
4467,C42058,DOID_5193,ganglioneuroblastoma neoplastic nodular process,nodular ganglioneuroblastoma,1
4468,C5130,DOID_4869,adenocystic adenoid breast carcinoma cystic mammary neoplastic process,adenoid carcinoma cystic laryngeal,0
4469,C6068,DOID_1355,accessory lymphoma neoplastic paranasal primary process sinus,paranasal sinus lymphoma,1
4470,C84795,DOID_0080036,corneal disease dystrophy epithelial juvenile meesmann syndrome,bone buchem disease dysplasia sclerosing sost related van,0
4471,C75011,DOID_0110950,waardenburg syndrome type 2a,2a iia syndrome type waardenburg ws2a,1
4472,C131133,DOID_0060251,disease or syndrome,sclerosteosis,1
4473,C5973,DOID_5536,cancer carcinoma neoplastic process supraglottic supraglottis throat,carcinoma cell sarcomatoid skin squamous,0
4474,C7266,DOID_5522,basaloid carcinoma cell large lung neoplastic process,basaloid carcinoma cell squamous,0
4475,C5846,DOID_4896,adenocarcinoma bile carcinoma colloid colloidal duct extrahepatic mucinous neoplastic process,adenocarcinoma bile duct,0
4476,C6155,DOID_4938,adenocarcinoma neoplastic process ureter ureteral,ureter adenocarcinoma,1
4477,C5451,DOID_6293,lipoma of central nervous system,central lipoma nervous system,1
4478,C4060,DOID_3269,ovarian cystadenoma,cystadenoma ovarian,1
4479,C4425,DOID_2595,glottis neoplasm neoplastic process tumor,cancer glottis,0
4480,C6548,DOID_6229,pediatric mature teratoma of the ovary,childhood mature ovary teratoma,1
4481,C75463,DOID_11983,prader willi syndrome,prader willi syndrome,1
4482,C5492,DOID_10657,colon colonic leiomyoma neoplastic process,colon colonic lymphangioma,0
4483,C92727,DOID_0050668,alcohol arbd birth defect disease related syndrome,alcohol related arbd birth defect,1
4484,C61254,DOID_10587,beta galactosidase cell deficiency disease galactosylceramide globoid krabbe leukodystrophy lipidosis syndrome,globoid cell leukodystrophy,1
4485,C34382,DOID_13382,anemia disease megaloblastic syndrome,anemia grasbeck imerslund hereditary imerslund grasbeck megaloblastic mga1 norwegian recessive rh mga1 syndrome type,1
4486,C3708,DOID_4743,cell germ neoplasm neoplastic no process tumor,cell germ mixed testicular tumor,0
4487,C4426,DOID_10069,neoplasm of subglottis,neoplasm subglottis,1
4488,C4426,DOID_0110374,neoplasm neoplastic process subglottic subglottis tumor,pigmentosa retinitis rp68,0
4489,C7910,DOID_5396,prolactin secreting pituitary tumor,carcinoma gland malignant neoplasm pituitary produce prolactin prolactin producing tumor,1
4490,C5475,DOID_5517,cancer carcinoma cell gastric neoplastic process squamous stomach,carcinoma gastric stomach,0
4491,C3867,DOID_5324,cancer carcinoma fallopian neoplastic process tube,cancer cell fallopian germ tube,0
4492,C34582,DOID_10314,disease endocarditis syndrome,endocarditis,1
4493,C84729,DOID_0111121,disease gilbert syndrome,nephronophthisis nphp13,0
4494,C7729,DOID_5518,penile epidermoid carcinoma,carcinoma cell penis squamous,1
4495,C5461,DOID_4439,cell central cns germ neoplasm neoplastic nervous process system tumor,central nervous system germ cell tumor,1
4496,C84709,DOID_1029,disease familial paralysis periodic syndrome,familial periodic paralysis,1
4497,C35668,DOID_13208,non proliferative diabetic retinopathy,background diabetic retinopathy,1
4498,C131633,DOID_2216,deficiency disease factor syndrome xiii,deficiency factor,0
4499,C35467,DOID_4,achenbach disease syndrome,disease,0
4500,C3868,DOID_0050922,gastrointestinal gist neoplasm neoplastic no process stromal tumor,carcinoma gastrointestinal,0
4501,C5250,DOID_3504,adenocarcinoma carcinoma cell cohesive gastric include neoplastic poorly process ring signet stomach,adenocarcinoma carcinoma cell prostate ring signet,0
4502,C9477,DOID_3078,high grade astrocytoma nos,anaplastic astrocytoma grade iii,1
4503,C27896,DOID_4231,disease multicentric reticulohistiocytosis syndrome,histiocytoma,0
4504,C35704,DOID_11213,conjunctivitis infective,acute conjunctivitis contagious,1
4505,C6584,DOID_8304,palisaded myofibroblastoma of the lymph node,lymph myofibroblastoma node palisade,1
4506,C3031,DOID_10040,eyelid neoplasm neoplastic process tumor,eyelid malignant melanoma,0
4507,C119734,DOID_2491,disease disorder nerve neuropathy peripheral syndrome,neuropathy peripheral sensory,0
4508,C84729,DOID_2739,disease gilbert syndrome,gilbert gilbert meulengracht syndrome,1
4509,C27037,DOID_4406,disease or syndrome,dermatitis spongiotic,1
4510,C6744,DOID_5566,mature neoplastic pericardial pericardium process teratoma,mature teratoma,0
4511,C7813,DOID_9544,cell neoplasm neoplastic plasma process refractory,refractory plasma cell neoplasm,1
4512,C3567,DOID_12756,malignant lacrimal duct neoplasm,cancer duct lacrimal,1
4513,C39885,DOID_7246,acinar adenocarcinoma lymphoepithelioma like neoplastic process prostate variant,lymphoepithelioma like acinar prostate adenocarcinoma,1
4514,C4949,DOID_901,primary hepatic lymphoma,liver lymphoma,1
4515,C75011,DOID_0110950,2a disease iia syndrome type waardenburg,waardenburg syndrome type iia,1
4516,C4949,DOID_901,primary liver lymphoma,liver lymphoma,1
4517,C26710,DOID_1910,bronchial bronchopneumonia disease lobular pneumonia syndrome,endodermal neoplasm sac sinus tumor vaginal yolk,0
4518,C3567,DOID_12756,neoplastic process,cancer duct lacrimal,1
4519,C9011,DOID_2658,dermoid cyst,cyst dermoid,1
4520,C4787,DOID_0050624,benign neoplasm of gastrointestinal system,benign gastrointestinal neoplasm system,1
4521,C122577,DOID_9362,asthmaticus disease status syndrome,status asthmaticus,1
4522,C34565,DOID_12375,disease dystrophy syndrome vulvar,bronchial bronchopneumonia lobular pneumonia,0
4523,C34782,DOID_14018,alcoholic cirrhosis disease syndrome,alcoholic liver cirrhosis,1
4524,C5396,DOID_6610,angioma bone epithelioid hemangioma neoplastic osseous process,bone hemangioma,1
4525,C123433,DOID_225,disease hyperlysinemia syndrome,syndrome,0
4526,C3564,DOID_5467,malignant tumor of conjunctiva,cancer conjunctiva conjunctival malignant neoplasm,1
4527,C6483,DOID_9601,atypical decubital disease fasciitis fibroplasia ischemic syndrome,fasciitis ischemic,1
4528,C2952,DOID_8577,colitis ulcerative,colitis ulcerative,1
4529,C126344,DOID_0060708,deficiency disease itk lpfs1 lymphoproliferative syndrome,cd27 deficiency lpfs2 lymphoproliferative syndrome,0
4530,C3188,DOID_2696,interstitial cell tumor,cell leydig tumor,1
4531,C27937,DOID_5595,papillary carcinoma of the thymus,adenocarcinoma papillary thymic,1
4532,C3031,DOID_2173,tumor of eyelid,eyelid neoplasm,1
4533,C3744,DOID_1618,fibroadenoma,breast fibroadenoma juvenile,1
4534,C27539,DOID_4299,basal carcinoma cell infiltrate neoplastic no process skin,basal carcinoma cell infiltrate infiltrative skin,1
4535,C35397,DOID_4364,disease pneumoconiosis slate syndrome,breast malignant melanoma,0
4536,C6346,DOID_4867,adenoid cystic carcinoma of cervix,adenoid carcinoma cervical cystic,1
4537,C4527,DOID_262,hemangiopericytoma kidney neoplastic process renal,kidney hemangiopericytoma,1
4538,C6529,DOID_5238,neoplastic process,benign perivascular tumor,1
4539,C119734,DOID_2477,disease disorder nerve neuropathy peripheral syndrome,motor neuropathy peripheral,0
4540,C6744,DOID_116,mature neoplastic pericardial pericardium process teratoma,cancer malignant neoplasm pericardium,0
4541,C35770,DOID_3393,arteriosclerosis disease monckeberg mo nckeberg syndrome,arteriosclerosis artery coronary disease heart,0
4542,C74995,DOID_0110872,disease or syndrome,holoprosencephaly hpe2,1
4543,C6840,DOID_3179,invert maxillary neoplastic papilloma process schneiderian sinus,invert papilloma,0
4544,C4616,DOID_0060061,cutaneous lipoma neoplastic process skin,cell cutaneous lymphoma t cell,0
4545,C3099,DOID_684,liver cell carcinoma,adult carcinoma hepatocellular primary,1
4546,C26934,DOID_13148,acute cystitis disease syndrome,acute cystitis,1
4547,C3088,DOID_268,angioendothelioma angiosarcoma hemangioendothelioma hemangiosarcoma malignant neoplastic process,angiosarcoma liver,0
4548,C99109,DOID_11723,disease dystrophy muscular syndrome walker warburg wws,duchenne dystrophy muscular,0
4549,C34619,DOID_13620,disease or syndrome,foramen ovale patent,1
4550,C54287,DOID_7409,carcinoma cell cylindrical neoplastic non keratinizing process ringertz schneiderian sinonasal squamous transitional,carcinoma cell non keratinizing squamous vulvar,0
4551,C6584,DOID_9942,lymph myofibroblastoma neoplastic node palisade process,disease lymph node,0
4552,C6022,DOID_5288,laryngeal leiomyosarcoma,larynx leiomyosarcoma,1
4553,C97179,DOID_11371,behavioral developmental disorder dysfunction mental pervasive,diarrhea functional,0
4554,C6282,DOID_5540,cancer carcinoma cell fallopian neoplastic process squamous tube,carcinoma cell fallopian squamous tube,1
4555,C39946,DOID_8394,adult cell granulosa neoplastic process testicular tumor type,adult cell granulosa testicular tumor type,1
4556,C3575,DOID_184,cancer endocrine gland malignant neoplasm neoplastic no process tumor,bone cancer malignant neoplasm,0
4557,C26748,DOID_12785,diabetic disease neuropathy syndrome,diabetic polyneuropathy,0
4558,C84646,DOID_2861,anemia congenital disease dyserythropoietic syndrome,anemia congenital hemolytic nonspherocytic,0
4559,C84883,DOID_4327,disease fever hemorrhagic marburg syndrome virus,marburg hemorrhagic fever,1
4560,C118634,DOID_0060844,disease norrie syndrome,norrie warburg disease,1
4561,C35194,DOID_0050572,disease dystrophy hereditary retinal syndrome,cone rod dystrophy retinal,0
4562,C7368,DOID_6505,benign calcify epithelioma epitherlioma follicle hair malherbe neoplasm neoplastic no pilomatricoma pilomatrixoma process,cell epithelioma spindle vaginal,0
4563,C39924,DOID_7097,neoplastic process,macrocystic pattern sac testicular tumor yolk,1
4564,C123262,DOID_12678,benign disease familial hypercalcemia hypocalciuric syndrome,hypercalcemia,0
4565,C4640,DOID_1992,malignant melanoma of the rectum,malignant melanoma rectum,1
4566,C6282,DOID_1749,cancer carcinoma cell fallopian neoplastic process squamous tube,cancer carcinoma cell squamous,0
4567,C4577,DOID_368,cerebral cancer,cancer cerebral cerebrum,1
4568,C3562,DOID_0110730,malignant neoplasm neoplastic orbit orbital process tumor,4a autosomal ceroid cln4a lipofuscinosis neuronal recessive,0
4569,C27204,DOID_178,collagen connective disease disorder inflammatory musculoskeletal pain rheumatic rheumatism rheumatologic syndrome tissue vascular,disease tissue vascular,0
4570,C6584,DOID_1629,lymph myofibroblastoma neoplastic node palisade process,breast myofibroblastoma,0
4571,C99100,DOID_14705,noack syndrome,acrocephalosyndactylia pfeiffer syndrome type,1
4572,C53459,DOID_2602,benign chondroma neoplastic no process,chondroma,1
4573,C3543,DOID_14547,malignant neoplasm neoplastic process sinus sphenoid sphenoidal tumor,carcinoma cell sinus sphenoid squamous,0
4574,C7739,DOID_255,angioma brain hemangioma neoplastic process,hemangioma,0
4575,C5041,DOID_92,speech disorder,disorder speech,1
4576,C7368,DOID_5374,benign pilomatrixoma,benign pilomatricoma pilomatrixoma,1
4577,C39885,DOID_7246,acinar adenocarcinoma lymphoepithelioma like neoplastic process prostate variant,acinar adenocarcinoma lymphoepithelioma like prostate variant,1
4578,C4533,DOID_4584,choroid malignant neoplasm neoplastic plexus process tumor,choroid meningioma plexus,0
4579,C7928,DOID_6053,childhood germ cell neoplasm,cancer cell germ pediatric,1
4580,C9011,DOID_5117,benign cyst cystic dermoid mature neoplastic no process subcutaneous teratoma tumor,cyst dermoid ovary,0
4581,C5846,DOID_3698,colloid extrahepatic bile duct adenocarcinoma,adenocarcinoma bile duct mucinous,1
4582,C6637,DOID_5560,soft tissue neoplasm of the mediastinum,mediastinal mesenchymal tumor,1
4583,C129031,DOID_5684,disease or syndrome,dysplasia sponastrime spondyloepimetaphyseal type,1
4584,C3716,DOID_6872,neoplasm neoplastic neuroectodermal neuroepithelioma no pnet primitive process tumor,cord neoplasm neuroectodermal primitive spinal,0
4585,C84777,DOID_0060877,bullosa disease ichthyosis siemens syndrome,bullous type ichthyosis,1
4586,C6248,DOID_12001,lymphoma neoplastic primary process trachea tracheal,tracheal lymphoma,1
4587,C61254,DOID_9842,beta galactosidase cell deficiency disease galactosylceramide globoid krabbe leukodystrophy lipidosis syndrome,choroid circumpapillary dystrophy total,0
4588,C6419,DOID_5697,liposarcoma of ovary,liposarcoma ovary,1
4589,C3424,DOID_13515,tsc,sclerosis tuberous,1
4590,C92727,DOID_0050668,alcohol related birth defect,alcohol related arbd birth defect,1
4591,C85078,DOID_0050817,disease stargardt syndrome,stargardt disease 1,1
4592,C82342,DOID_14483,chorea disease hd huntington syndrome,chorea gravidarum,0
4593,C3980,DOID_11832,disease or syndrome,epilepsy visual,1
4594,C116973,DOID_13921,bacterial bv disease syndrome vaginosis,bacterial esophagitis,0
